{
  "active_eligible": false,
  "artifact_id": "bootstrap-anomaly-shadow-only-v1",
  "created_at": "2026-07-27T00:00:00Z",
  "feature_names": [
    "rejection_rate",
    "retry_rate",
    "no_progress_streak",
    "tool_switch_rate",
    "latency_delta_ms",
    "transition_nll"
  ],
  "feature_schema_version": "0.1.0",
  "provenance": {
    "dataset_sha256": "0000000000000000000000000000000000000000000000000000000000000000",
    "method": "hand_authored_bootstrap_not_for_promotion",
    "seed": 0,
    "training_rows": 4
  },
  "sample_size": 4,
  "schema_version": "0.1.0",
  "threshold": 0.65,
  "trees": [
    {
      "feature": 0,
      "left": {
        "feature": 2,
        "left": {
          "feature": null,
          "left": null,
          "right": null,
          "size": 2,
          "split": null
        },
        "right": {
          "feature": null,
          "left": null,
          "right": null,
          "size": 1,
          "split": null
        },
        "size": 3,
        "split": 2.5
      },
      "right": {
        "feature": null,
        "left": null,
        "right": null,
        "size": 1,
        "split": null
      },
      "size": 4,
      "split": 0.5
    }
  ]
}
